{
  "$schema": "https://json-schema.org/draft/2020-12/schema",
  "$id": "modeldoorloop-variant.schema.json",
  "title": "Variant van de regeltabel voorbeelduitwerking leerroute 1 (Jochem)",
  "description": "Een planningsvorm naast de basisuitwerking, als eigen bestand modeldoorloop-lr1-<vorm>.json. De variant erft van de basis de rollen, toestanden, koppelingen, scope-uitzonderingen en de modelcommit, en draagt zelf per fase haar stappen en haar regels. De regels hebben dezelfde woordenlijst als in de basis (modeldoorloop-lr1.schema.json#/$defs/regel); alleen het beeld-ID draagt een letter per vorm (#401).",
  "type": "object",
  "required": ["basis", "vorm", "fasen", "regels"],
  "properties": {
    "basis": {"type": "string", "description": "de bestandsnaam van de basisregeltabel waarvan de kop wordt geerfd"},
    "vorm": {"type": "string", "enum": ["capaciteitsgestuurd", "geroosterd"], "description": "de planningsvorm; gelijk aan het deel van de bestandsnaam na modeldoorloop-lr1-. De basis is de vraaggestuurde vorm"},
    "fasen": {
      "type": "array",
      "description": "de fasen die de variant raakt, met de stappen van deze vorm; naam en MORA-hoofdproces komen uit de basis",
      "items": {
        "type": "object",
        "required": ["nummer", "bron", "stappen"],
        "additionalProperties": false,
        "properties": {
          "nummer": {"type": "integer", "minimum": 1, "maximum": 8},
          "bron": {"type": "string", "description": "waar deze stappen vandaan komen; de basis volgt het kaderscenario, een variant de instellingspraktijk"},
          "stappen": {"type": "array", "items": {"type": "string"}, "minItems": 1},
          "voorafgegaan_door": {"type": "array", "items": {"type": "string", "pattern": "^F[1-8]-[CR]?[0-9]{2}$"}, "description": "de beelden die in dit traject aan de variant voorafgaan, uit de basis of uit een andere variant, zoals de animo-uitvraag voor een keuze op capaciteit"},
          "vervangt": {"type": "array", "items": {"type": "string", "pattern": "^F[1-8]-[CR]?[0-9]{2}$"}, "description": "de beelden die in deze vorm vervallen of naar deze fase verschuiven, uit de basis of uit een eerdere variant, zoals de plaatsing uit F4-09 die bij een geroosterde keuze al in fase 6 gebeurt"},
          "toelichting":{"type": "string", "description": "een of twee zinnen over wat deze vorm in deze fase anders doet, en waarom"}
        }
      }
    },
    "regels": {
      "type": "array",
      "description": "de regels van de variant; het beeld-ID draagt de letter van de vorm: C voor capaciteitsgestuurd, R voor geroosterd",
      "items": {"allOf": [{"$ref": "modeldoorloop-lr1.schema.json#/$defs/regel"}, {"properties": {"beeld_id": {"pattern": "^F[1-8]-[CR][0-9]{2}$"}}}]}
    }
  },
  "additionalProperties": false
}
