{
  "basis": "voorbeeld-lr1-regels.json",
  "vorm": "capaciteitsgestuurd",
  "fasen": [
    {
      "nummer": 2,
      "bron": "instellingspraktijk: capaciteitsgestuurd plannen (#402)",
      "stappen": [
        "Keuzedeelaanbod plannen op inzetbare capaciteit en prognose",
        "Gepland keuzedeelaanbod terugleveren aan de onderwijscatalogus"
      ],
      "toelichting": "Het kaderscenario beschrijft vraaggestuurd plannen: de planner vormt groepen nadat de studenten hebben gekozen. Deze variant toont capaciteitsgestuurd plannen, in de instellingspraktijk de meest voorkomende vorm. De planner plant vooraf op inzetbare capaciteit, zoals docenten met de juiste expertise en lokaaltypen, en op een prognose, omdat die capaciteit maar beperkt schaalbaar is. Bij de keuze ligt daardoor al meer vast: de planninggroepen, het maximaal aantal studenten en de periode. Fase 1, 3, 5 en 8 blijven in deze vorm gelijk."
    },
    {
      "nummer": 4,
      "bron": "instellingspraktijk: capaciteitsgestuurd plannen (#402)",
      "stappen": [
        "Keuzedeelgroep met vaste capaciteit aan het roostersysteem geven"
      ],
      "voorafgegaan_door": [
        "F2-C01"
      ],
      "toelichting": "Het keuzedeel wordt pas geroosterd na de toewijzing in fase 6; dan ligt ook het weekmoment vast."
    },
    {
      "nummer": 6,
      "bron": "instellingspraktijk: capaciteitsgestuurd plannen (#402)",
      "stappen": [
        "Capaciteit vaststellen na de animo",
        "Geplande leergelegenheden ontsluiten naar het studentkeuzesysteem",
        "Plek kiezen op een geplande leergelegenheid",
        "Toewijzen binnen de capaciteit"
      ],
      "voorafgegaan_door": [
        "F6-01",
        "F6-02",
        "F6-03",
        "F6-04"
      ],
      "vervangt": [
        "F6-05",
        "F6-07"
      ],
      "toelichting": "In deze vorm kiest de student op een geplande leergelegenheid. Hoe die uit de specificatie rijpt, bepaalt het onderwijsontwerp van de instelling. Het keuzedeelaanbod voor de animo komt via de catalogus; de aanmelding daarop (F6-03) geeft een voorkeur, en de keuze volgt op de leergelegenheid. Na de animo stelt de planner de capaciteit vast. Een afwijking tussen prognose en animo tot 50 procent ligt in dit voorbeeld binnen de marge; daarboven verbetert de instelling de prognose zelf. De capaciteit gaat rechtstreeks van planning naar het studentkeuzesysteem. F6-06 neemt de uitkomst daarvan mee (KD-A blijft, KD-B is geannuleerd), en F6-08 geldt ook hier."
    },
    {
      "nummer": 7,
      "bron": "instellingspraktijk: capaciteitsgestuurd plannen (#402)",
      "stappen": [
        "Vrijgekomen plek binnen de capaciteit verwerken",
        "Vrije plek ontsluiten naar het studentkeuzesysteem"
      ],
      "toelichting": "Bij bijsturen blijft de bestaande planninggroep staan: een plek die vrijkomt, gaat binnen de capaciteit terug naar het studentkeuzesysteem."
    }
  ],
  "regels": [
    {
      "beeld_id": "F2-C01",
      "beeld": "Keuzedeel K0037 vooraf gepland op capaciteit",
      "fase": 2,
      "stap": "Keuzedeelaanbod plannen op inzetbare capaciteit en prognose",
      "soort": "ontstaat",
      "wie": "planner",
      "objecttype": "Keuzedeel aanbod",
      "instantie": "K0037 Farmaceutische Patientenzorg, periode 7, locatie A: prognose 30, dus twee groepen",
      "bron": "instellingspraktijk: capaciteitsgestuurd plannen (#402)",
      "toestand": "gepland",
      "nieuwe_instantie": true,
      "relatie": {
        "soort": "Association",
        "van": "Keuzedeel",
        "naar": "Keuzedeel aanbod",
        "instantie": "K0037 Farmaceutische Patientenzorg"
      },
      "zin": "De planner plant het keuzedeel vooraf op inzetbare capaciteit en een prognose van 30 studenten: twee planninggroepen van maximaal 24, omdat docenten met de juiste expertise en lokaaltypen maar beperkt schaalbaar zijn."
    },
    {
      "beeld_id": "F2-C01",
      "beeld": "Keuzedeel K0037 vooraf gepland op capaciteit",
      "fase": 2,
      "stap": "Keuzedeelaanbod plannen op inzetbare capaciteit en prognose",
      "soort": "ontstaat",
      "wie": "planner",
      "objecttype": "Leergelegenheid",
      "instantie": "K0037 Farmaceutische Patientenzorg, periode 7, planninggroep KD-A, maximaal 24: lokaaltype balie-simulatie, docentexpertise farmacie",
      "bron": "instellingspraktijk: capaciteitsgestuurd plannen (#402)",
      "toestand": "gepland",
      "nieuwe_instantie": true,
      "relatie": {
        "soort": "Association",
        "van": "Leeronderdeel specificatie",
        "naar": "Leergelegenheid",
        "instantie": "het leeronderdeel van K0037 waaruit de leergelegenheid rijpt"
      }
    },
    {
      "beeld_id": "F2-C01",
      "beeld": "Keuzedeel K0037 vooraf gepland op capaciteit",
      "fase": 2,
      "stap": "Keuzedeelaanbod plannen op inzetbare capaciteit en prognose",
      "soort": "ontstaat",
      "wie": "planner",
      "objecttype": "Leergelegenheid",
      "instantie": "K0037 Farmaceutische Patientenzorg, periode 7, planninggroep KD-B, maximaal 24: lokaaltype balie-simulatie, docentexpertise farmacie",
      "bron": "instellingspraktijk: capaciteitsgestuurd plannen (#402)",
      "toestand": "gepland",
      "nieuwe_instantie": true,
      "relatie": {
        "soort": "Association",
        "van": "Leeronderdeel specificatie",
        "naar": "Leergelegenheid",
        "instantie": "het leeronderdeel van K0037 waaruit de leergelegenheid rijpt"
      }
    },
    {
      "beeld_id": "F2-C02",
      "beeld": "Geplande keuzedeelgroepen naar de catalogus",
      "fase": 2,
      "stap": "Gepland keuzedeelaanbod terugleveren aan de onderwijscatalogus",
      "soort": "stroomt",
      "van": "Planningssysteem",
      "naar": "Onderwijscatalogus",
      "pijl": "id-020f091db6ea4763aad7527a98afaf99",
      "koppeling": "OC-P&R",
      "objecttype": "Keuzedeel aanbod",
      "instantie": "K0037 Farmaceutische Patientenzorg, periode 7, locatie A: twee groepen gepland",
      "bron": "instellingspraktijk: capaciteitsgestuurd plannen (#402)"
    },
    {
      "beeld_id": "F2-C02",
      "beeld": "Geplande keuzedeelgroepen naar de catalogus",
      "fase": 2,
      "stap": "Gepland keuzedeelaanbod terugleveren aan de onderwijscatalogus",
      "soort": "stroomt",
      "van": "Planningssysteem",
      "naar": "Onderwijscatalogus",
      "pijl": "id-020f091db6ea4763aad7527a98afaf99",
      "koppeling": "OC-P&R",
      "objecttype": "Leergelegenheid",
      "instantie": "K0037 Farmaceutische Patientenzorg, periode 7, planninggroep KD-A, maximaal 24",
      "bron": "instellingspraktijk: capaciteitsgestuurd plannen (#402)"
    },
    {
      "beeld_id": "F2-C02",
      "beeld": "Geplande keuzedeelgroepen naar de catalogus",
      "fase": 2,
      "stap": "Gepland keuzedeelaanbod terugleveren aan de onderwijscatalogus",
      "soort": "stroomt",
      "van": "Planningssysteem",
      "naar": "Onderwijscatalogus",
      "pijl": "id-020f091db6ea4763aad7527a98afaf99",
      "koppeling": "OC-P&R",
      "objecttype": "Leergelegenheid",
      "instantie": "K0037 Farmaceutische Patientenzorg, periode 7, planninggroep KD-B, maximaal 24",
      "bron": "instellingspraktijk: capaciteitsgestuurd plannen (#402)"
    },
    {
      "beeld_id": "F4-C01",
      "beeld": "Na de toewijzing: de keuzedeelgroep met vaste capaciteit naar het roostersysteem",
      "fase": 4,
      "stap": "Keuzedeelgroep met vaste capaciteit aan het roostersysteem geven",
      "soort": "stroomt",
      "van": "Planningssysteem",
      "naar": "Roostersysteem",
      "pijl": "id-08467fe302794db6b935ff685e83efe0",
      "koppeling": null,
      "objecttype": "Leergelegenheid",
      "instantie": "K0037 Farmaceutische Patientenzorg, periode 7, planninggroep KD-A, 24 plaatsen; het weekmoment volgt bij het roosteren",
      "bron": "instellingspraktijk: capaciteitsgestuurd plannen (#402)",
      "zin": "Het keuzedeel wordt pas geroosterd na de toewijzing in fase 6. De planninggroep en de capaciteit liggen dan vast; het weekmoment volgt bij het roosteren."
    },
    {
      "beeld_id": "F6-C01",
      "beeld": "Capaciteit vastgesteld na de animo",
      "fase": 6,
      "stap": "Capaciteit vaststellen na de animo",
      "soort": "verandert",
      "wie": "planner",
      "objecttype": "Leergelegenheid",
      "instantie": "K0037 Farmaceutische Patientenzorg, periode 7, planninggroep KD-A: 19 aanmeldingen bij de animo tegen een prognose van 30, een groep van 24 blijft",
      "bron": "instellingspraktijk: capaciteitsgestuurd plannen (#402)",
      "toestand": "gepland",
      "zin": "Na de animo stelt de planner de capaciteit vast: een groep is genoeg. De docentinzet en het lokaal van KD-B gaan terug naar de inzetplanning. Een afwijking van ongeveer 37 procent ligt binnen de marge die de instelling in dit voorbeeld hanteert; vanaf 50 procent verbetert zij de prognose zelf."
    },
    {
      "beeld_id": "F6-C01",
      "beeld": "Capaciteit vastgesteld na de animo",
      "fase": 6,
      "stap": "Capaciteit vaststellen na de animo",
      "soort": "verandert",
      "wie": "planner",
      "objecttype": "Leergelegenheid",
      "instantie": "K0037 Farmaceutische Patientenzorg, periode 7, planninggroep KD-B: geannuleerd",
      "bron": "instellingspraktijk: capaciteitsgestuurd plannen (#402)",
      "toestand": "geannuleerd"
    },
    {
      "beeld_id": "F6-C02",
      "beeld": "Geplande leergelegenheid naar het studentkeuzesysteem",
      "fase": 6,
      "stap": "Geplande leergelegenheden ontsluiten naar het studentkeuzesysteem",
      "soort": "stroomt",
      "van": "Planningssysteem",
      "naar": "Student Keuze Systeem (SKS)",
      "pijl": "id-6268df4c8b1e4a1ca02d4bd6732b8b34",
      "koppeling": null,
      "objecttype": "Leergelegenheid",
      "instantie": "K0037 Farmaceutische Patientenzorg, periode 7, planninggroep KD-A, 24 plaatsen",
      "bron": "instellingspraktijk: capaciteitsgestuurd plannen (#402)",